{
    "type": "event",
    "class": "PacketEvent",
    "entity": "_earthquake_ether_inspector",
    "uuid": "1f13eaa6-4b92-45f0-a4de-1236081dc649",
    "deferred": true,
    "option": {
        "src_process": "zksrv1",
        "dst_process": "zksrv3",
	"message": {
            "ZkQuorumPacket": {
		"AckQP": {
                    "zxid_low": 0,
                    "zxid_high": 1
		}
	    }
        }
    }
}
